{"boundary":{"input_ref":"app://inbound_candidate/1001","output_ref":"app://surfaced_event/1001"},"declaration_version":1,"evaluator":{"authority":"advisory","epistemic_status":"ground_truth","evaluation_basis":{"kind":"human_gold","ref":"response_quality_human_gold"},"property":"response_quality","target":"output","technique":"human","version":"2"},"payload":{"relevance_judgment":"correct","reviewer":"grader-07","schema_version":2},"payload_schema":"https://paa.dev/payload-schemas/response-quality-human.schema.json","producer":{"id":"human-grader","version":"2"},"record_id":"evrec-inbound-case-1001-human","record_schema":"paa-evidence-record/0.1.0-draft","scope":null,"source_references":["grades:9021"],"subject":{"id":"case-1001","kind":"case"},"task":"inbound_reply_surfacing","timestamps":{"completed_at":"2026-01-06T09:04:00.000Z","recorded_at":"2026-01-06T09:04:30.000Z","started_at":"2026-01-06T09:00:00.000Z"},"verdict":{"reason_codes":["reviewer_confirmed_tone","reviewer_confirmed_accuracy"],"value":"approve"}}
