{"boundary":{"input_ref":"sha256:2222222222222222222222222222222222222222222222222222222222222222","output_ref":"sha256:3333333333333333333333333333333333333333333333333333333333333333"},"declaration_version":1,"evaluator":{"authority":"advisory","epistemic_status":"proxy","evaluation_basis":{"kind":"rubric","ref":"response_quality_rubric"},"property":"response_quality","target":"output","technique":"llm_judge","version":"1"},"payload":{"arm_id":"candidate","base_subject_ref":"sha256:bbbbbbbbbbbbbbbbbbbbbbbbbbbbbbbbbbbbbbbbbbbbbbbbbbbbbbbbbbbbbbbb","cell_id":"s7:candidate:w2","detail_refs":["sha256:dddddddddddddddddddddddddddddddddddddddddddddddddddddddddddddddd"],"evaluator_id":"quality","evaluator_repeat":0,"plan_ref":"sha256:1111111111111111111111111111111111111111111111111111111111111111","run_id":"run-1","worker_repeat":2},"payload_schema":"https://paa.dev/payload-schemas/assay-scalar-quality.schema.json","producer":{"id":"assay","version":"0.1.0"},"record_id":"run-1:s7:candidate:w2:quality:e0","record_schema":"paa-evidence-record/0.3.0-draft","scope":null,"source_references":["sha256:dddddddddddddddddddddddddddddddddddddddddddddddddddddddddddddddd","sha256:eeeeeeeeeeeeeeeeeeeeeeeeeeeeeeeeeeeeeeeeeeeeeeeeeeeeeeeeeeeeeeee"],"subject":{"id":"s7:candidate:w2","kind":"run"},"task":"inbound_reply_surfacing","timestamps":{"completed_at":"2026-09-10T17:00:02.000Z","recorded_at":"2026-09-10T17:00:02.500Z","started_at":"2026-09-10T17:00:00.000Z"},"verdict":{"reason_codes":["within_range"],"value":0.875},"worker":{"configuration_ref":"sha256:cccccccccccccccccccccccccccccccccccccccccccccccccccccccccccccccc","id":"jig-agent","version":"candidate-v1"}}
