{"boundary":{"input_ref":"app://inbound_candidate/1001","output_ref":"app://surfaced_event/1001"},"declaration_version":1,"evaluator":{"authority":"advisory","epistemic_status":"proxy","evaluation_basis":{"kind":"rubric","ref":"response_quality_rubric"},"property":"response_quality","target":"output","technique":"llm_judge","version":"1"},"payload":{"model":"critic-v1","rubric_id":"response_quality_rubric_v1","score":0.86},"payload_schema":"https://paa.dev/payload-schemas/response-quality-llm.schema.json","producer":{"id":"llm-critic","version":"1"},"record_id":"evrec-inbound-case-1001-llm","record_schema":"paa-evidence-record/0.1.0-draft","scope":null,"source_references":["critiques:5501"],"subject":{"id":"case-1001","kind":"case"},"task":"inbound_reply_surfacing","timestamps":{"completed_at":"2026-01-05T12:00:02.000Z","recorded_at":"2026-01-05T12:00:02.500Z","started_at":"2026-01-05T12:00:00.000Z"},"verdict":{"reason_codes":["tone_within_bounds","no_hallucinated_claim"],"value":"approve"}}
